{
  "schemaVersion": 1,
  "generator": "docstyle 1.0.0",
  "document": "rec-document",
  "records": {
    "rec-document": { "id": "rec-document", "recordType": "document",
      "schemaVersion": 1, "privacy": "public",
      "type": "protocol", "title": "Example protocol", "version": "2.1" },
    "rec-person-1": { "id": "rec-person-1", "recordType": "person",
      "schemaVersion": 1, "privacy": "public",
      "name": { "given": "Jane", "family": "Smith" } },
    "contrib-1": { "id": "contrib-1", "recordType": "contribution",
      "schemaVersion": 1, "privacy": "public",
      "document": "rec-document", "person": "rec-person-1", "position": 1 }
  },
  "views": {
    "g-span-k3m7ap": { "id": "g-span-k3m7ap",
      "recordType": "metadata-view", "schemaVersion": 1,
      "privacy": "public",
      "sourceRecord": "rec-document", "path": "version",
      "presentation": "span" }
  },
  "objects": {
    "tbl-outcomes": { "id": "tbl-outcomes", "type": "table",
      "semantics": { "label": "Table 1",
        "caption": "g-caption-x2r9qa", "summary": "Outcomes by arm" } }
  },
  "assets": {
    "asset-flow": { "id": "asset-flow", "path": "media/flow.png",
      "mediaType": "image/png",
      "hash": "sha256:0000000000000000000000000000000000000000000000000000000000000000" }
  }
}
